[
{"id":"A00001","itemDescription":"Oracle Test Item Description","metric":"Test Metric","cost":47500,"aliases":["Test Alias #01","Test Alias #02"],"option":false},
{"id":"A00002","itemDescription":"Oracle Test Item Description","metric":"Test Metric","cost":47501,"aliases":["Test Alias #01","Test Alias #02"],"option":false}
]




   